{
  "schema_version": 1,
  "hypothesis_id": "HYP-EXIT-001",
  "title": "Geometría pareada de TP/RR sobre las entradas actuales",
  "frozen": true,
  "research_only": true,
  "notice": "Research only - No señal - No bot",
  "trial_budget": 210,
  "seed": 20260801,
  "dataset": {
    "classification": "recycled_research_data",
    "setup_export": "data/setup_backtest_trades.json",
    "candle_pattern": "data/klines_{pair}_{timeframe}.json",
    "pairs": ["BTCUSDT", "ETHUSDT", "SOLUSDT", "ADAUSDT", "XRPUSDT"],
    "timeframes": ["1h", "4h"]
  },
  "design": {
    "paired_on": "setup_id",
    "same_entry": true,
    "same_stop_loss": true,
    "activation_bar_tp_credit": false,
    "same_bar_precedence_after_activation": "stop_loss_first",
    "timeout": "close_at_exported_max_forward_bar",
    "targets": [
      {"id": "rr_0_5", "rr": 0.5},
      {"id": "rr_0_75", "rr": 0.75},
      {"id": "rr_1", "rr": 1.0},
      {"id": "rr_2", "rr": 2.0},
      {"id": "rr_3", "rr": 3.0},
      {"id": "rr_5", "rr": 5.0},
      {"id": "original", "rr": null}
    ],
    "cost_definition": "total_rate is the full entry-plus-exit fee and slippage fraction of entry notional; cost_R = total_rate / abs(entry-sl)/entry",
    "cost_scenarios": [
      {"id": "base", "total_rate": 0.0014, "label": "base"},
      {"id": "hard", "total_rate": 0.0025, "label": "duros"},
      {"id": "extreme", "total_rate": 0.004, "label": "extremos"}
    ]
  },
  "statistics": {
    "bootstrap": {"unit": "calendar_month", "iterations": 2000},
    "multiple_testing": "holm",
    "multiple_testing_family": "unique_target_vs_original_paired_differences_cost_invariant",
    "sample_sufficiency": "confidence_interval_and_minimum_detectable_effect",
    "dsr": "explicitly_blocked_v1",
    "pbo": "explicitly_blocked_v1"
  },
  "sizing": {
    "primary": "fixed_nominal_risk",
    "fixed_fraction_for_context": 0.01,
    "mixing_forbidden": true
  },
  "dependence": {
    "iid_assumption": false,
    "document_overlap": true,
    "document_cross_pair_correlation": true,
    "document_account_heat": true,
    "sequence_monte_carlo": "explicitly_blocked_until_regime_preserving_blocks_are_validated"
  },
  "governance": {
    "automatic_winner_selection": false,
    "promotion": false,
    "execution_enabled": false
  }
}
